{
  "chosen_model": "ENCL-800",
  "fit_score": 0.8090909090909091,
  "gaps": {
    "D": 0.1667,
    "H": 0.1909,
    "HEAT": 0.15,
    "W": 0.1875
  },
  "ip_rating": "IP54",
  "max_heat_w": 1500.0,
  "price": 1750000.0,
  "slot_unit": 1.2,
  "utilisation": {
    "D": 0.8333333333333334,
    "H": 0.8090909090909091,
    "HEAT": 0.85,
    "W": 0.8125
  }
}